Lat,Lon,Title,Alert ID,Publication date,Reporting date,State,District,News,Animal,Cases,Deaths,Week,Year,Title1,News Source,Link,Publication Language,
24,87.583333,Birbhum West Bengal,13,,,West Bengal,Birbhum,"Outbreak  of  loose  motion,  vomiting  and  abdominal  pain  reported from Bharat Savaram Vidyalaya, Village Sangha, Block Suri, District Birbhum due to consumption of contaminated food rice served in mid day  meal.  Medical team investigated the  outbreak.  Cases treated locally.  32  children treated  at  Sub  District  Hospital,  Suri.  ORS packets given to cases.  IEC activities done.",,96,0,41,2012,Birbhum West Bengal,IDSP,https://idsp.nic.in/,English,
27.5201658,95.5306347,2012,2,,,Assam,Tinsukia,"Outbreak reported from LP School Panitola, Village Majbari TE, SC Panitola,  PHC  Hapjan,  District  Tinsukia  due to  consumption  of contaminated  food  (mid-day  meal).  Medical  team  investigated  the outbreak.  Cases  treated  symptomatically.  Food  samples  collected",,59,0,48,2012,Tinsukia Assam,IDSP,https://idsp.nic.in/,English,
18.67154,78.0988,Nizamabad Andhra Pradesh,1,,,Andhra Pradesh,Nizamabad,"Outbreak  of  loose  motion,  vomiting  and  abdominal  pain  reported from  ZPH  School,  Village  &  SC  Fareedpet,  PHC  Machareddy, Block  Domakonda,  District  Nizamabad  due to  consumption  of contaminated  food  (mid-day  meal).  Medical  team  investigated  the outbreak.  Temporary  health  camp  organized  in  the  locality.  Cases treated  symptomatically.  ORS  packets  given  to  cases.  37  patients treated at AH Kamareddy. Health education given.",,126,0,48,2012,Nizamabad Andhra Pradesh,IDSP,https://idsp.nic.in/,English,
16.9984287,81.7156149,East Godavari Andhra Pradesh,1,,,Andhra Pradesh,East Godavari,"Outbreak  of  loose  motion,  vomiting  and  abdominal  pain  reported from Village Laxmi  nagar, SC Godarigunta, Block Kakinada, District East  Godavari  due to  consumption  of  contaminated  food  (potato curry, chicken curry, dal) in  mid day meal. Medical team investigated the outbreak. Cases treated locally. Health education given regarding food hygiene.",,91,0,51,2012,East Godavari Andhra Pradesh,IDSP,https://idsp.nic.in/,English,
18.43915,79.12856,2012,1,,,Andhra Pradesh,Karimnagar,"Outbreak  of  vomiting  reported  from  Gullakota  High  School,  SC Gullakota, PHC Ambaripet, District Karimnagar due to consumption of contaminated food (rice, egg, sambhar in mid day meal).  Medical team  investigated  the  outbreak.  Cases  were  treated  at  local  health centre  and  Distrcit  Hospital,  Karimnagar.  Food  sample  collected",,32,0,51,2012,Karimnagar Andhra Pradesh,IDSP,https://idsp.nic.in/,English,
13.3400771,77.1006208,Tumkur Karnataka,3,,,Karnataka,Tumkur,"Outbreak  of  loose  motion,  vomiting  and  abdominal  pain  reported from  Kittur  Ranichennamma  School,  CHC/Block  Pavagada,  District Tumkur  due to  consumption  of  contaminated  food  in  mid day  meal. District  RRT  investigated  the  outbreak.  Temporary  medical  camp organized.  Cases  treated  symptomatically.  Health  education  given regarding food hygiene.",,79,0,4,2013,Tumkur Karnataka,IDSP,https://idsp.nic.in/,English,
20.4686,85.8792,Cuttack Odisha,6,,,Odisha,Cuttack,"Outbreak  of loose  motion  and  vomiting  reported  from  Bhagipur Primary  School,  Village  Bhagipur,  SC  Gayalbanks,  CHC  Dompada, District Cuttack due to consumption of contaminated food in mid day meal.  Medical  team  investigated  the  outbreak.  Medicine  and  ORS packets  given  to  cases.  Health  education  given  regarding  safe  food habits.",,95,0,6,2013,Cuttack Odisha,IDSP,https://idsp.nic.in/,English,
19.4129711,85.0471041,Ganjam Odisha,5,,,Odisha,Ganjam,"Outbreak  of loose  motion,  vomiting,  pain  abdomen  reported  from  Ucha Prakalp  Vidyalay  of  Village  &  SC  Gothagaon,  CHC  Sheragada,  District Ganjam,  due  to  consumption  of  contaminated  food  (Mid-Day  meal).  District RRT  investigated  the  outbreak.  All  cases  treated  at  CHC  Hinjicut.  Health education given regarding food hygiene, sanitation.",,95,0,25,2013,Ganjam Odisha,IDSP,https://idsp.nic.in/,English,
15.2196136,74.1152813,South Goa Goa,4,,,Goa,South Goa,"Cases  with  pain  in  abdomen  and  vomiting  reported  from  Sri Mallikarjun  High  school,  Canacona  after  consuming  Mid-day meal  comprising  of  Bread  &  Bhaji.  RRT investigated the outbreak  and  Food  and  Drug  Administration  (FDA)  officials collected food samples. The food samples showed presence of E. Coli. All the 86 children who consumed the meal were screened and those symptomatic were treated. MO - I/C, sanitary inspector and doctor from Canacona CHC inspected the serving place and found it neat and clean. kitchen could not be inspected as it was locked.",,23,0,26,2013,South Goa Goa,IDSP,https://idsp.nic.in/,English,
22.0621745,87.8367238,Purba Medinipur West Bengal,13,,,West Bengal,Purba Medinipur,"Outbreak  reported  from  village  Gobindpur,  GP  Paldhui,  BPHC/RH Bararankua,  Block  Ramnagar-II,  District  Purba  Medinipur.  Cases reported with pain in abdomen, nausea and vomiting after taking Mid-day  meals.  District  RRT  along  with  Block  RRT  &  ACMOH  team visited the area. One water sample collected tested negative with H2S kit testing. Treatment given with ORS.",,133,0,27,2013,Purba Medinipur West Bengal,IDSP,https://idsp.nic.in/,English,
14.2266443,76.4005122,Chitradurga Karnataka,5,,,Karnataka,Chitradurga,"Cases  were  reported  after taking  Mid-day  meal  suspected to  be contaminated in  Muruarji  Residential  school,  Village  Devarkotta, PHC  Abbinahole,  Taluk  Hiriyur of district  Chitradurga.  RRT investigated  the  outbreak.  Rice  samples  (cooked)  were  collected  and sent to State Public Health  Lab, result awaited.  Treatment was  given to  those  affected.  IEC  done  regarding  safe  water,  food  and  personal hygiene.",,22,0,27,2013,Chitradurga Karnataka,IDSP,https://idsp.nic.in/,English,
14.5404644,77.6620826,Ananthapur Andhra  Pradesh,1,,,Andhra  Pradesh,Ananthapur,"Cases of pain in abdomen, loose motion and vomiting reported from MPUP school,  Village  Nemakallu,  PHC  Bommanahal,  CHNC Kanekal,  District  Ananthapur.  Poor  sanitary  &  hygienic  conditions were observed in the affected area. All the cases had consumed Mid-day  meal.   7 year  old female child expired  at Bellary  Hospital. RRT investigated  the  outbreak.  3  stool  samples  were  collected  &  sent  to Govt. Medical College Ananthapur, Kliebsiella growth was present in all  the  samples.   All  5  water  samples  collected  &  sent to  Govt. Medical  College  Ananthapur,  showed  growth  of  E.  Coli  on  culture.   Chlorination of the Water Tank done. All cases treated. IEC activities conducted.",,23,1,28,2013,Ananthapur Andhra  Pradesh,IDSP,https://idsp.nic.in/,English,
26.350072,86.2291469,2013,3,,,Bihar,Madhubani,"Cases  of  abdominal  pain   and  giddiness reported  from  Utkramit Midddle  School  Village  Noorchak,  SC  Noorchak  Navtoli,  PHC Bisfi, District Madhubani after consuming mid day meal. District RRT investigated the outbreak. Cases were treated at PHC Bisfi. Food  sample  collected  by food inspector,  Madhubani",,223,0,1,2015,Solapur Maharashtra,IDSP,https://idsp.nic.in/,English,
15.6044413,74.0017241,North Goa Goa,3,,,Goa,North Goa,"Outbreak reported from St. Joseph, High School, Village Usgao, Block Ponda, District North Goa. Children developed abdominal pain   after 2 hours  of  consumption of  mid day  meal  (Pulav  and curry).  District  RRT  investigated  the  outbreak.  Cases  treated  at sub  district  Hospital.  All  cases recovered.  Health  education given.",,24,0,30,2013,North Goa Goa,IDSP,https://idsp.nic.in/,English,
15.6044413,74.0017241,North Goa Goa,3,,,Goa,North Goa,"Outbreak  reported  from  Shri  Kamleshwar  High  School,  Village Deulwada,  SC  Korgao,  Block  Pernem,  District  North  Goa. District  RRT  investigated  the  outbreak.  All  children  developed colicky  abdominal  pain  and  vomiting  after  consumption  of  mid day meal (Bread and bhaji). Cases treated at sub district Hospital. All cases recovered. No food samples collected.",,19,0,30,2013,North Goa Goa,IDSP,https://idsp.nic.in/,English,
21.966667,80.333333,Balaghat Madhya Pradesh,9,,,Madhya Pradesh,Balaghat,"Outbreak  reported  from  reported  from  Village  Pipariya,  Block Waraseoni,  District  Balaghat.  Medical team investigated the outbreak.   Cases  presented  with  nausea  and  vomiting  after consuming mid day meal. Cases treated at local health centre. All cases recovered.",,33,0,30,2013,Balaghat Madhya Pradesh,IDSP,https://idsp.nic.in/,English,
25.4887735,74.6996128,2013,2011,,,Rajasthan,Bhilwara,"Cases  of food  poisoning  reported from  Govt  G.U.P.S  Mali, Mohalla Banera, Block Banera, Distrcit Bhilwara.  Medical team investigated the outbreak.  Cases presented  with headache, stomach ache and drowsiness after consuming mid day meal (dal rice) in the school. Cases treated at CHC Banera.  3 food samples were collected (2 samples of dal and 1 sample of rice) and sent to Ajmer for lab  examination",,35,0,27,2015,Pune Maharasthra,IDSP,https://idsp.nic.in/,English,
24.967852,86.1735115,2013,3,,,Bihar,Jamui,"Outbreak  of  loose  motion,  vomiting  and  pain  abdomen  reported from  Village  Kalugha,  SC  Chapa,  PHC  Jhajha,  District  Jamui. District RRT  investigated the outbreak.  Cases consumed  food  in mid day meal at Utkramit Madhay Vidyalaya. Cases were treated at  referral  Hospital,  Jhajha.  All  cases  recovered.  Food  samples collected",,7,0,29,2013,Madhubani Bihar,IDSP,https://idsp.nic.in/,English,
15.6044413,74.0017241,North Goa Goa,4,,,Goa,North Goa,"Cases  of  vomiting,  nausea,  and  abdominal  pain  reported from  Old  Goa  Educational  Institute  High  School,  Distrcit North Goa.  Medical team investigated the outbreak. Cases consumed  mid-day  meal  (patal  bhaji).    All  cases  treated.  Health  education  given  regarding  safe  food  habit,  hygiene and sanitation.",,23,0,36,2013,North Goa Goa,IDSP,https://idsp.nic.in/,English,
26.2649879,87.3716265,Araria Bihar,3,,,Bihar,Araria,"Cases  of  loose  motion,  vomiting  and  pain  in  abdomen  reported from  Middle  School  Jagir  Parsi,  Village  Kursakata,  District Araria. Medical team investigated the outbreak. Cases consumed food at mid day meal. Cases treated symptomatically. IEC done.",,54,0,44,2013,Araria Bihar,IDSP,https://idsp.nic.in/,English,
12.3821775,75.6653199,Kodagu Karnataka,5,,,Karnataka,Kodagu,"Cases of loose motion, vomiting and abdomen pain reported from School in Village/SC Ballamavaty, PHC Napoklu, Block/District Kodagu.   District  RRT investigated the outbreak.  Cases consumed  food in Mid-day  meal.  Symptomatic treatment given to  cases.  Health  education  given  regarding  food  hygiene  and sanitation.",,28,0,7,2014,Kodagu Karnataka,IDSP,https://idsp.nic.in/,English,
20.5004008,86.4317062,Kendrapara Odisha,7,,,Odisha,Kendrapara,"An outbreak of food poisoning reported from Kharinasi Primary School, Village Kharinasi, SC/PHC Ramnagar CHC Mahakalapara, District Kendrapara.   District RRT investigated the  outbreak.  Active  search  for  cases  done.  Cases  consumed food  in  mid-day  meal.    Cases  treated  at  locally.  Symptomatic treatment given to cases. Health education given regarding food hygiene and sanitation.",,73,0,10,2014,Kendrapara Odisha,IDSP,https://idsp.nic.in/,English,
18,79.58333,2014,1,,,Andhra Pradesh,Warangal,"Cases of vomiting  and  abdominal pain were reported from Banjaranagar, NAC Centre, Village / PHC / CHC Thorrur,  District  Warangal.  District  RRT  investigated the outbreak. Cases consumed food in mid day meal. All  cases  treated  symptomatically.  Food  and  water samples  were  collected  and  sent  to  KMC  Warangal",,21,0,2011,2014,Warangal Andhra Pradesh,IDSP,https://idsp.nic.in/,English,
23.1156882,77.0662394,2014,9,,,Madhya Pradesh,Sehore,"Cases  of  diarrhoea  and  vomiting  reported  from  Village Balapura, Block Ichhawar, District Sehore. District RRT investigated  the  outbreak.    Active  search  for new  cases done. Cases consumed food in mid day meal. All cases treated symptomatically.  Food samples sent",,79,0,31,2013,Bhilwara Rajasthan,IDSP,https://idsp.nic.in/,English,
19.4129711,85.0471041,2014,2011,,,Odisha,Ganjam,"Cases of with vomiting, diarrhea and pain abdomen reported from a primary  school in  Adapada,  PHC/Block  Sanakhemundi,  District Ganjam.  Medical  team  investigated  the  outbreak.  Cases  consumed food in  mid-day  meal  programme  (rice,  dal  &  mix  vegetable).  Symptomatic treatment given to cases. 2 food samples sent to Public Health  Lab",,68,0,31,2013,Jamui Bihar,IDSP,https://idsp.nic.in/,English,
16.8579636,79.2174935,Nalgonda Telangana,13,,,Telangana,Nalgonda,"Cases of vomiting and diarrhoea reported from a Primary School in Marepalli,  SC  Marepalli,  PHC/Block  Haliya,  District  Nalgonda. Medical  team  investigated  the  outbreak.  Cases  consumed  food  in mid-day  meal.   Symptomatic treatment  given to  cases.  Health education given regarding food hygiene and sanitation.",,,0,34,2014,Nalgonda Telangana,IDSP,https://idsp.nic.in/,English,
16.6965686,77.9591146,2014,13,,,Telangana,Mahabubnagar,"Cases of food poisoning reported from Government Primary School, Village Maldoddy, SC Dyagadoddi, PHC Dharoor, District Mahabubnagar. On 30th Sep, 25 students consumed midday meal in school out of which  20  students  developed  vomiting,  abdominal pain and headache. A  medical camp was organized",,86,0,31,2015,Ajmer Rajasthan,IDSP,https://idsp.nic.in/,English,
24.818124,85.5185562,2014,1,,,Bihar,Nawada,"Case  of  vomiting  and  abdominal  pain reported from Village/  SC   Ajampur,  Block   Warsaliganj,District Nawada. District RRT investigated the outbreak.  Active search  for  cases  done.  Cases  had  consumed  common food (Khichhdi) in a mid day meal programme. All cases treated symptomatically. Food sample sent",,60,0,33,2014,Sehore Madhya Pradesh,IDSP,https://idsp.nic.in/,English,
22.5760669,88.4200676,South parganas West Bengal,9,,,West Bengal,South parganas,"Cases  reported  from  Village  Haradhanpur,  GP  Dhaspur Sumatinagar, Block Sagar,  Distt South Parganas. Students fell ill after consuming  mid day  meal in school and  presented  with  vomiting,  pain  abdomen.  A  lizard was discovered later in meals",Lizard,124,0,38,2014,South parganas West Bengal,IDSP,https://idsp.nic.in/,English,
24,88,South 24 pargana West Bengal,12,,,West Bengal,South 24 pargana,"Cases  reported  from  Jalaberia  Sahachari  School,  village Ratikontomore, GP Jalaberia I, Block Kultali, district South 24  Paragana.  District  and  Block  RRT investigated the outbreak. Onset of symptoms after 10 hours of eating Mid Day  Meal  containing  cooked  dal  with  Lizard  in  it.2  stool samples  sent  to  CNMCH,  both  samples  were  negative  for any  pathogenic  organism.  Active  case  search  done.IEC done.",Lizard,46,0,47,2014,South 24 pargana West Bengal,IDSP,https://idsp.nic.in/,English,
17.05439,79.26707,Nalgonda Andhra Pradesh,2,,,Andhra Pradesh,Nalgonda,"Cases  reported  from  Village  Annaram,  SC  PHC/  Mandal Chervu  Annaram,  Mandal  Kattangur,  Distt  Nalgonda.  A total  of  174  students  consumed  midday  meal,  after  which 34  of  them  developed  symptoms  of  Nausea,  Vomiting, headache and stomach pain. Medical team visited the area. Health  education  given  to  the  food  handlers,  school  staff and students regarding food hygiene.",,36,0,48,2014,Nalgonda Andhra Pradesh,IDSP,https://idsp.nic.in/,English,
17.05439,79.26707,Nalgonda Andhra Pradesh,2,,,Andhra Pradesh,Nalgonda,"Cases reported from  Village /  SC  Aitipamula,  PHC/ Mandal Kattangur, Distt Nalgonda.  A total of 131 students consumed midday meal, after which 32 of them developed symptoms  of  Nausea,  Vomiting,  headache  and  stomach pain. Medical team visited the area. Health education given to  the  food  handlers,  school  staff  and  students  regarding food hygiene.",,32,0,48,2014,Nalgonda Andhra Pradesh,IDSP,https://idsp.nic.in/,English,
13.1006135,79.1260283,Ranga Reddy Andhra Pradesh,1,,,Andhra Pradesh,Ranga Reddy,"Cases  reported  from  Village  Kotbarpally,  SC  Sangakalam, PHC  Gingurthy,  District  Ranga  Reddy.  District  RRT investigated the  outbreak  All the cases  had  history of consumption  of  midday  meal.  Health  education  given  on drinking water and personal hygiene. No human samples sent for testing.",,19,0,49,2014,Ranga Reddy Andhra Pradesh,IDSP,https://idsp.nic.in/,English,
17.8499067,75.2763203,2015,8,,,Maharashtra,Solapur,"Cases reported from Village Korti, Block Karmala, District Solapur.  District  RRT  investigated  the  outbreak.  All  the cases  had a history of  consuming food (khicdi in mid day meal) at a private school, 03 vomitus samples sent to state public  health laboratory  Pune",,51,0,34,2014,Ganjam Odisha,IDSP,https://idsp.nic.in/,English,
18.67154,78.0988,Nizamabad Andhra Pradesh,1,,,Andhra Pradesh,Nizamabad,"Cases reported from Village Eakkapally primary school, PHC Lingam  Pet,  CHC  Yellareddy,  District  Nizamabad.  District RRT investigated the outbreak.  All the children had consumed midday meal after which they developed vomiting, pain abdomen and headache. No human samples were sent. It was  revealed  on investigation  that  baking  soda  was  used instead  of  salt  in  meal.  All  cases  treated  symptomatically. Health education given.",,40,0,2,2015,Nizamabad Andhra Pradesh,IDSP,https://idsp.nic.in/,English,
18.75,78.25,Nizamabad Telangana,8,,,Telangana,Nizamabad,"Cases reported from  primary school  of  PHC  Eakkapally,  PHC Lingampet,  CHC  Yellareddy,  District  Nizamabad.  District  RRT investigated  the  outbreak.    Children  of  the  school  consumed  midday meal  after  which  they  developed  vomiting  and  pain  abdomen.  All children  treated  at  CHC.  On  investigation  it  was  revealed  that  baking soda was used instead of salt for food preparation. RRT visited the area.  Health education given.",,40,0,13,2015,Nizamabad Telangana,IDSP,https://idsp.nic.in/,English,
18.67154,78.0988,Nizamabad Andhra Pradesh,1,,,Andhra Pradesh,Nizamabad,"Cases reported from ZPHS School, Chukkapur Village, PHC Machareddy,  CHNC  Domakonda,  District  Nizamabad.  33 children had mid day  meal  with rice,  dal,  sambar  and  boiled eggs.  After 2 hours children complained of vomiting, abdominal  pain  and  headache.  District  RRT  investigated  the outbreak.  House  to  house  survey  was  done.  Medical  Camp organized on 06.02.2015 in ZPHS School and all cases treated symptomatically. Health education given.",,33,0,6,2015,Nizamabad Andhra Pradesh,IDSP,https://idsp.nic.in/,English,
17.68009,83.20161,Vishakhapatnam Andhra Pradesh,1,,,Andhra Pradesh,Vishakhapatnam,"Cases  of  nausea,  vomiting  and  diarrhea  reported  from  ZP High School, PHC/Mandal K.D. Peta District Visakhapatnam. District RRT investigated the outbreak. All the  cases  consumed  midday  meal  in  school.    All  the  cases treated symptomatically. Chlorination of water source done.  Health education given.",,18,0,10,2015,Vishakhapatnam Andhra Pradesh,IDSP,https://idsp.nic.in/,English,
23.5,91.666667,South Tripura Tripura,9,,,Tripura,South Tripura,"Cases  of  loose  stools  were  reported  from  South  Mirzapur  High School  under  Belonia  Municipal  Council,  District  South  Tripura. District  RRT  investigated  the  outbreak.  All  the  cases  consumed food during  mid-day  meal in the school. All the cases were in 11-14  years  age  group.  All  cases treated  symptomatically.  Health education given.",,23,0,15,2015,South Tripura Tripura,IDSP,https://idsp.nic.in/,English,
16.8579636,79.2174935,Nalgonda Telangana,15,,,Telangana,Nalgonda,"Cases  reported  from  Primary  school at Enubamulla Village, SC Patha Suryapet, Mandal, PHC Athmakur, SPHO Suryapet, District Nalgonda. District RRT investigated the outbreak. All cases were  school students who consumed food during mid day meal consisting of  tomato, potato curry  and  boiled  egg.01  Water  sample  was  sent  to  RWS  Laboratory which was found to be non potable. All cases treated symptomatically. Health education given.",,15,0,25,2015,Nalgonda Telangana,IDSP,https://idsp.nic.in/,English,
18.5204,73.8567,2015,6,,,Maharasthra,Pune,"Cases reported from Village SC Ballalwadi, PHC Otur, Block Junner, District Pune. District  RRT  investigated  the  outbreak.  All  cases  consumed  food  in  midday  meal consisting  of  Shira  which  was  prepared  on  the  previous  day..  1  stool  and  2  water samples collected",,20,0,35,2014,Mahabubnagar Telangana,IDSP,https://idsp.nic.in/,English,
16.8579636,79.2174935,Nalgonda Telangana,14,,,Telangana,Nalgonda,"Cases  reported  from  Village  G.  Thirmalagiri,  PHC  Suryapet  Mandal Chivemla,  District  Nalgonda.District  RRT  investigated  the  outbreak. House  to  house  survey  done.  All  the  students  had  mid-day  meal  with Dal  Curry  and  egg,  After  half  hour  33  students  complained  of  nausea, giddiness,  and  vomiting.  All  cases treated  Symptomatically.  Health education given.",,33,0,27,2015,Nalgonda Telangana,IDSP,https://idsp.nic.in/,English,
26.1180626,85.3132056,Muzzafarpur Bihar,3,,,Bihar,Muzzafarpur,"Cases  of  acute  onset  vomiting  and  diarrhea  reported  from  Village/  HSC Dharpur,  PHC  Minapur.  District  RRT  investigated  the  outbreak.  All  cases had  consumed  mid-day  meal  consisting  of  rice  and  vegetables.  All  cases treated symptomatically. Health education given.",,49,0,29,2015,Muzzafarpur Bihar,IDSP,https://idsp.nic.in/,English,
26.4691,74.639,2015,16,,,Rajasthan,Ajmer,"Cases  of  pain  abdomen  and  vomiting  reported  from  Government  Upper Primary School, Village Jaswantpura, PHC Ghatiyali, Block Kekri. District RRT  investigated  the  outbreak.  All  the  cases  consumed  rice  ���khichdi��� under Mid day meal in school. All 04 water sample tested at DPL, Ajmer, were  found to  be  potable.6  samples  of  food  (soyabean  oil,  red  chilli  powder,  potato,  rice,  turmeric  powder,  salt)  taken  under  non  PFA",,34,0,35,2015,North District Delhi,IDSP,https://idsp.nic.in/,English,
21.8314,76.3498,Khandwa Madhya Pradesh,6,,,Madhya PradeshMadhya Pradesh,Khandwa,"Cases  of  nausea  and  abdominal  pain  reported  from  Village  Pipalkota PHC Jawar Block Khandwa.  District RRT investigated the outbreak. All cases consumed food (Dal, Chapati and Rice) in mid day meal at middle school. All cases treated symptomatically. Health education given.",,41,0,33,2015,Khandwa Madhya PradeshMadhya Pradesh,IDSP,https://idsp.nic.in/,English,
19.67203,78.5359,Adilabad Telengana,27,,,Telengana,Adilabad,"Cases reported from IIT  Basar,  District  Adilabad.  District  RRT investigated  the  outbreak.  All  cases  consumed  food  (rice,  dal,  and curry)  provided  during  mid-day  meal.  Health  camp  was  organized  in the  campus  and  all  cases  treated  symptomatically.  Health  education given.",,57,0,34,2015,Adilabad Telengana,IDSP,https://idsp.nic.in/,English,
28.6920791,77.2797342,2015,5,,,Delhi,North District,"Cases  reported  from  Government.  Girl  Senior  Sec  Girl  School,  A Block, Jahangir Puri, Delhi. District RRT investigated the outbreak. All  the  cases  consumed  food  in  mid-day  meal.01  Gastic  Aspirate sent  to  forensic  laboratory  for  further  testing",,34,0,35,2015,Chandauli Uttar Pradesh,IDSP,https://idsp.nic.in/,English,
25.1265777,83.2496558,2015,16,,,Uttar Pradesh,Chandauli,"Cases  of  vomiting,  pain  abdomen  and  loose  stools    reported  from Primary  School,VillageSahepur,  Block  Chahaniya.  District  RRT investigated  the  outbreak.  All  cases  consumed  food  (Khir)  in  mid-day meal. Food (Khir) sample collected and sent for analysis",,16,0,38,2014,Nawada Bihar,IDSP,https://idsp.nic.in/,English,
23.2495714,87.8681751,Burdwan West Bengal,28,,,West Bengal,Burdwan,"Cases of vomiting and loose stools reported from BalikaVidhayaya,Village Raina-2,Barboinan. District RRT investigated  the  outbreak.  All  cases  consumed  lunch  which  was provided in the school mid day meal (Rice, Dal and  Bhujiya). All cases treated symptomatically. Health education given.",,134,0,38,2015,Burdwan West Bengal,IDSP,https://idsp.nic.in/,English,
16.8579636,79.2174935,2015,18,,,Telangana,Nalgonda,"Cases  of  pain  abdomen,  headache  and  vomiting  reported  from Village/PHC  Chandur,  Zilla  Parisad  High  School.  District  RRT investigated the  outbreak.  All  cases  consumed  common  meal consisting  of  rice,  tomato  curry,  rasam  and  dal  in  mid-day  meal. Food samples of raw material (Dal, Salt, Chili Powder, Tamarind, Oil,  Rice  and   Turmeric  Powder) sent to  Food  Laboratory, Nacharam, Hyderabad",,156,0,40,2015,Nalgonda Telangana,IDSP,https://idsp.nic.in/,English,
27.1752554,78.0098161,Agra Uttar Pradesh,19,,,Uttar Pradesh,Agra,"Cases  of  pain  abdomen  and  vomiting  reported  from  Government Primary  and  Junior  School  of  Village  Oont  Giri  (Pahari  Kala), Block Kheragarh. District RRT investigated the outbreak. All cases consumed milk provided in the mid-day meal. Milk sample sent to food testing laboratory. Plastic particles and low fat contents were found in the  milk.  All  cases treated  symptomatically.  Health education given.",,87,0,40,2015,Agra Uttar Pradesh,IDSP,https://idsp.nic.in/,English,
