Lat,Lon,Title,Alert ID,Publication date,Reporting date,State,District,News,Animal,Cases,Deaths,Week,Year,Title1,News Source,Link,Publication Language,
14.7874825,75.3996731,Haveri Karnataka,3817,31-12-2016,02-01-2017,Karnataka,Haveri,"Three children of the Government Primary School of Mantaguni village in Savanur taluk of Haveri district fell ill after reportedly consuming the midday meal on Friday. The officials in the Department of Public Instructions said that a total of 42 children have been admitted to the district government hospital as a precautionary measure. The children complained that a cockroach was found in the food cooked to serve during midday meal. The department would probe into the issue, the officials said.",Cockroach,3,0,53,2016,Haveri Karnataka,The Hindu,http://www.thehindu.com/todays-paper/tp-national/tp-karnataka/Three-children-taken-ill-after-midday-meal/article16967551.ece,English ,
24.4931239,85.5560811,Koderma Jharkhand,4863,31-08-2018,04-09-2018,Jharkhand,Koderma,"A student died and around hundred others fell ill allegedly after consuming mid-day meal at a school in Koderma district of Jharkhand, police said on Friday.Koderma Deputy Commissioner Bhuvnesh Pratap Singh has ordered an inquiry. All hundred students have recovered and are back to school, Koderma Superintendent of Police M Tamilvanan told PTI. The students of Upgraded Middle School were admitted to the local Sadar Hospital after they complained of stomach ache and vomiting on Wednesday, the SP said.They were allegedly taken ill after taking their meal of rice, paneer and potato curry,.",,100,1,35,2018,Koderma Jharkhand,Tribune India,https://m.tribuneindia.com/article/student-dies-100-others-fall-ill-after-consuming-mid-day-meal-in-jharkhand-school/645592,English ,
22.6001502,77.9266452,Hoshangabad Madhya Pradesh,5551,30-09-2019,30-09-2019,Madhya Pradesh,Hoshangabad,"In yet another incident surrounding the government's flagship mid-day meal scheme, as many as sixteen children fell ill on Friday at a primary school here, after consuming the mid-day meal.According to reports, the children started vomiting as soon as they reached home after having their lunch at the government primary school in Amrai village of the district's Kesla block.The kids were then rushed to the Community Health Centre in Sukhtawa, where they are undergoing treatment. All the children are reportedly in a stable condition presently. According to reports, the kids were served 'Kadi-Chawal' for their meal, which is provided by a local self-help group.",,16,0,40,2019,Hoshangabad Madhya Pradesh,etvbharat.com,https://www.etvbharat.com/english/national/state/madhya-pradesh/16-kids-fall-ill-upon-consuming-mid-day-meal-at-mp-school/na20190927145922396,English ,
27.9126331,79.7465629,Shahjahanpur Uttar Pradesh,5494,29-08-2019,29-08-2019,Uttar Pradesh,Shahjahanpur,"As many as 26 students of a primary school in Behlolpur village of Powayan block in Shahjahanpur district fell ill after eating mid-day meal on Wednesday afternoon. All the children were below 12 years of age and were admitted at community health centre (CHC) by the school staff with the help of local villagers. The children had khichdi and milk in the meal and reported pain in their stomach. Basic Shiksha Adhikari (BSA) Rakesh Kumar rushed to the CHC and ordered a probe in the matter. He has assured parents of action against those found guilty. While doctors said that the condition of all the children was stable after treatment and they were discharged in the evening. Rakesh Kumar told TOI, Doctor has claimed that children fell Ill due to food poisoning and their condition is stable now. Action will be taken against t",,26,0,35,2019,Shahjahanpur Uttar Pradesh,Times of India,https://timesofindia.indiatimes.com/city/bareilly/26-children-fall-ill-after-having-mid-day-meal-in-shahjahanpur/articleshow/70882877.cms,English ,
23.8096123,78.7591136,Sagar Madhya Pradesh,4653,29-05-2018,29-05-2018,Madhya Pradesh,Sagar,"Five children were on Monday taken ill after eating midday meal in which dead rats were found, in an anganwadi centre in a village in Madhya Pradesh s Sagar district. our dead rats were found in the food served in the midday meal to the children in the anganwadi centre in Semra Bag village under Sagar district, a senior district officer said. We have sacked the cook concerned and action would be taken against other concerned officials after a probe into the incident , local sub-division magistrate said. ccording to official sources, some officials in the anganwadi centre spotted the dead rats and alerted its in-charge to stop distributing them among the children. ut, by then five children had already consumed the meal and fallen sick. They were rushed to Bundelkhand Medical College Hospital in the area. The anganwadi centre provides nutritious food to the malnutrition-affected children in the village in t",Rat,5,0,22,2018,Sagar Madhya Pradesh,The Asian Age ,"English Newspaper 29th May, 2018/Page No. 03",English ,
14.7874825,75.3996731,Haveri Karnataka,6506,28-12-2021,28-12-2021,Karnataka,Haveri,"As many as 80 school children fell sick on Monday after consuming sambar in which a dead lizard was found in Venkatapura Tanda village near Ranibennur in Haveri district of Karnataka. The incident took place in the Government Primary school of Venkatapura Tanda. The children fell sick after consuming midday meal. All of them have been rushed to the government hospital in Ranibennur town. According to sources in the education department, the condition of two of the children is stated to be ",Lizard,80,0,53,2021,Haveri Karnataka,ahmedabadmirror.com,https://ahmedabadmirror.com/karnataka-dead-lizard-found-in-sambar-80-students-fall-sick/81815899.html,English ,
18.316551,78.0539381,Kamareddy Telangana,6391,28-10-2021,28-10-2021,Telangana,Kamareddy,"About 80 students of the Mandal Praja Parishad (MPP) Primary School in Birkur of Kamareddy district fell ill after consuming the midday meal in the school on Wednesday. Post taking ill, they were they shifted to a government hospital in Banswada in ambulances.Officials concerned said all students had recovered after receiving treatments. Assembly Speaker Pocharam Srinivas Reddy visited the hospital and consoled the students. The school earlier only took in girl students, but from this academic year, started admitting boys too. The total strength of the school is 326, out of which 264 students attended the school on Wednesday. After two hours, some of the students started vomiting while a few others showed other symptoms. After hearing the news, parents reached the school and called ambulances, in which the students were shifted to Banswada area hospital. Kamareddy District Education Officer (DEO) and Birkur Mandal Education Officer (MEO) P Nageshwar Rao inspected the school and monitored the situation.",,80,0,44,2021,Kamareddy Telangana,The New Indian Express,https://www.newindianexpress.com/states/telangana/2021/oct/28/80-students-in-telanganas-kamareddy-district-ill-after-eating-midday-meal-2376743.html,English ,
23.25,83,Surguja Chhattisgarh,3606,28-08-2016,29-08-2016,Chhattisgarh,Surguja,"At least 60 students of a government primary school were taken ill allegedly after consuming food under mid-day meal programme at a village in Chhattisgarh s Surguja district. The students were admitted to Ambikapur district hospital with symptoms of food poisoning by the school authority on Saturday afternoon, Surguja Collector Bhim Singh said on Sunday. As per the information, the students started vomiting and complained of nausea after eating the mid-day meal at the government primary school in Sundarpur village, about 5 km from Ambikapur town and nearly 350 km from Raipur, he said. When the teachers and school Principal Indraprasad Sarathi noticed the deteriorating condition of children, they immediately admitted 60 students to Ambikapur, he said. The condition of children was (later) said to be normal and most of them have been discharged this morning, the Collector said. According to doctors, prima facie it appears that the food served to children at the school was raw and not that led to food poisoning, he said. The food samples have been sent for testing and the exact reason behind the incident will be known only after the reports are out, Singh said, adding, further action will be taken accordingly. Meanwhile, the Collector has asked to withdraw the services of Durga Self-Help Group which was tasked with preparing mid-day meal at the school.",,60,0,36,2016,Surguja Chhattisgarh,newsnation.in,http://www.newsnation.in/article/144181-60-children-fall-ill-after-mid-day-meal-at-school-in-chhattisgarh.html,English ,
11.9346006,76.9328209,Chamarajanagar Karnataka,3543,28-07-2016,01-08-2016,Karnataka,Chamarajanagar,"Fifteen students became ill after having their midday meal on Wednesday at the Vaddakehall Government Higher Primary School in Chamarajanagar district. Over 140 students study in class 1 to class 8 in the school which comes under Kaudalli cluster.After the middday meal, 15 students started vomiting. The teachers called Sulvadi government hospital's Dr Rajiv, who rushed to the school and checked them. Food poisoning is said to be the cause.Parents, who came to know about the incident, rushed to the school and demanded their children be admitted to a hospital. Three 108 ambulances from Mahadeswara Hill and Kaudalli were called and all 140 students were shifted to the Kollegal Government Hospital where the children were treated and sent home. Meanwhile, block education officer Yashodha visited the school and took details from teachers and parents.",,15,0,31,2016,Chamarajanagar Karnataka,Times of India,http://timesofindia.indiatimes.com/city/mysuru/Nearly-15-students-fall-sick-after-having-midday-meal/articleshow/53426128.cms,English ,
12.9767936,77.590082,Bengaluru Karnataka,5127,28-01-2019,30-01-2019,Karnataka,Bengaluru,"Twenty students of a government school were hospitalised as they complained of stomach ache and vomiting after having midday meal on Monday. he incident took place around 1pm at Government Primary School, Nimbekayipura, near KR Puram. Twenty minutes after having their midday meal, the children complained of stomach ache and started vomiting. he school s lone teacher, with help of local residents, rushed them to Srinivasa Hospital in Hoskote. Bengaluru (south) block education officer (BEO) Salim Pasha told TOI that food samples have been sent to laboratory for analysis. Dr Srinivas, duty doctor at Srinivasa Hospital, said 12 of the students were admitted as they were severely exhausted. All students are out of danger,",,20,0,5,2019,Bengaluru Karnataka,Times of India,https://timesofindia.indiatimes.com/city/bengaluru/bengaluru-20-students-fall-ill-after-having-midday-meal/articleshow/67727580.cms,English ,
17.7138983,80.0413425,Mahabubabad Telangana,5357,27-06-2019,27-06-2019,Telangana,Mahabubabad,"As many as 12 students fell ill after consuming rice served during mid-day meal at anganwadi centre in Kesamudram mandal in Mahabubabad district. The students were rushed to area hospital after a teacher noticed a dead lizard in the rice bowl. The students of adjacent government primary school also had the same meal. Though none of the students showed immediate signs of food poisoning, some complained of nausea after a while. Doctors said all the students are out of danger.",Lizard,12,0,26,2019,Mahabubabad Telangana,Times of India,https://timesofindia.indiatimes.com/city/hyderabad/lizard-in-mid-day-meal-12-kids-fall-ill/articleshow/69965635.cms,English ,
11.2450558,75.7754716,Kozhikode Kerala,5358,27-06-2019,28-06-2019,Kerala,Kozhikode,"The presence of Shigella bacteria was found in the meal served in Keezhpayoor West LP School which had resulted in a food poisoning incident. Following this the district administration has issued strict instructions. However, one week into the incident, the source of the deadly bacteria hasn t been identified. The source can be confirmed only after the test results from the Regional Analytical Lab is obtained. Now the test result of only water is obtained. The presence of coliform bacteria was found in it, but there were no E. coli bacteria. Hence the source can be found only after obtaining complete test results, said DMO Dr V Jayasree. In the wake of this, the district disaster management met under deputy collector Shamin Sebastian and instructed the school authorities. The responsibility of meals in school vests with the midday meal committee. PTA president, school HM, ward member, two teachers and student representative are included in the committee. The nodal officer among the teacher will be resle for the meal distribution. All norms are to be followed. The quality of the water, utensils, rice, vegetables and other edible items are to be ensured. All the cereals and vegetables are to be properly cleaned.",,,0,26,2019,Kozhikode Kerala,Mathrubhumi,https://english.mathrubhumi.com/news/kerala/suspected-food-poisoning-in-kozhikode-school-shigella-bacteria-found-in-meal-1.3908129,English ,
29.4060489,78.4808784,Bijnor Uttar Pradesh,4578,26-03-2018,27-03-2018,Uttar Pradesh,Bijnor,"As many as 50 students of Faiz-ul Quran Madrassa in Bijnor s Nagina town were taken ill on Monday after a lizard was found in the midday meal they had consumed. As many as 27 of them were rushed to a local hospital as it was suspected that they were suffering from food poisoning. Sources said some 50 students of madrassa were served midday meal and were eating it when teachers spotted a lizard in one of the food vessels. They immediately stopped serving. Soon those who had eaten the meal started vomiting. As the condition of 27 of them deteriorated, they were rushed to a hospital here. A case has been registered against the midday meal supplier and two others under relevant sections of the IPC. According to officials, there are around six madrassas in Nagina which avail government schemes. The Faiz-ul Quran Madrassa with 268 students on its rolls from Class I to V is also covered under the midday s",Lizard,50,0,13,2018,Bijnor Uttar Pradesh,Times of India,https://timesofindia.indiatimes.com/city/meerut/50-madrassa-students-fall-ill-after-lizard-found-in-midday-meal/articleshow/63471533.cms,English ,
19.6808639,72.8253734,Palghar Maharashtra,3299,26-02-2016,26-02-2016,Maharashtra,Palghar,"For A 60-bed sub-district hospital in Kasa in the newly formed Palghar district, it was a panic alarm Thursday evening with 247 children being rushed in with symptoms of food poisoning. The children reportedly fell sick after consuming mid-day meal at a zila parishad school in Kasa Budruk village. The khichdi served to the students was prepared by the International Society for Krishna Consciousness (ISKCON), which also supplies mid-day meal to various government schools in Mumbai. While many of the children were treated on out-patient department basis and discharged, 104 students had to be admitted, with two children sharing one bed and a few accommodated on mattresses on the ward floors. According to Dr Pradeep Narayan Dhodi, the medical officer on duty at the Kasa sub-district hospital, the condition of all 104 had stablised by night. They will be kept under observation, he said. Soon after consuming the khichdi in the afternoon, officials said, the students started complaining of vomiting nausea and abdominal pain.",,247,0,9,2016,Palghar Maharashtra,The Indian Express,http://indianexpress.com/article/india/india-news-india/palghar-247-children-fall-ill-after-eating-mid-day-meal-prepared-by-iskcon/,English ,
20.8415619,84.3213321,Boudh Odisha,5592,25-10-2019,28-10-2019,Odisha,Boudh,"As many as 50 students of a school in Kantamala block of the district were taken ill after consuming mid-day meal today.The incident occurred at the Government-run Lokapada primary school in Boudh district. Reportedly, students complained of stomach pain and vomiting after consuming the food. They were rushed to Manamunda Community Health Centre (CHC) for primary treatment. ",,50,0,43,2019,Boudh Odisha,m.dailyhunt.in,https://m.dailyhunt.in/news/india/english/odisha+sun+times-epaper-osuntime/50+students+fall+ill+after+mid+day+meal+consumption+in+odisha-newsid-143977656,English ,
21.75,86.5,2017,4384,25-10-2017,26-10-2017,Odisha,Mayurbhanj,"As many as 22 students of Brahmanamara Ashram School under Morada block of Mayurbhanj district fell ill allegedly after consuming mid-day meals at the school here on Tuesday. According to sources, the students had Upma in their breakfast  in lunch they were provided rice, dal, mix-vegetable and Soya bean curry and later they had watered rice and fried vegetables. However, it was soon after they consumed their meal at the school, they complained of stomach pain accompanied by vomiting and loose motion. The affected students were immediately rushed to Morada Hospital here and later shifted to Baripada hospital. While 20 of them are out of danger, the health condition of two students is still stated to be critical, sources added.",,22,0,43,2017,Mayurbhanj Odisha,Odisha TV,http://odishatv.in/odisha/body-slider/students-fall-ill-after-eating-mid-day-meal-in-school-250665/,English,
28.6517178,77.2219388,30,4764,25-07-2018,25-07-2018,Delhi,Delhi,"no arrests Thirteen children and a helper were hospitalised after they allegedly consumed the midday meal at an anganwadi in Dwarka s Uttam Nagar, the police said on Tuesday. The police were informed around noon that 13 children and a woman had fallen ill right after consuming rice and boiled gram as part of their midday meal at anganwadi number 27 in Hastsal Vihar, said Deputy Commissioner of Police (Dwarka) Anto Alphonse. After the police reached the spot, the children and helper Rama, who has been working as a helper at the anganwadi for the last five to six months, told them that they had vomited and fainted after the meal. They were all rushed to Deen Dayal Upadhyay Hospital where they are undergoing treatment,",,13,0,30,2018,Delhi,The Hindu ,"The Hindu
English Newspaper
25th July, 2018/Page No. 21",The Hindu ,
21.9671264,82.6647242,Janjgir-Champa Chhattisgarh,3674,24-09-2016,26-09-2016,Chhattisgarh,Janjgir-Champa,"At least 21 students of a government-run primary school fell ill after consuming a mid-day meal in Chhattisgarh. The incident took place at a village in the state s Janjgir-Champa district, the police said. The incident comes under the Pamgarh police station limits, and a senior police official from there says that reportedly the mid-day meal included fungus-infected pickles. This led the students to fall sick and suffer from vomiting and nausea after eating the meal. This unfit meal was served to the students of a school in Pendri village. Noticing that the children were not feeling well, the school teachers immediately rushed them to the local community health centre in Pamgarh. The senior police official said that their condition had been reported to be normal. On the face of it, the fungus-infected pickles which were served along with the mid-day meal seem to be the reason behind making the children sick. However, an official said that a probe will also be carried out in order to reach the root ca the incident. Investigation has begun already and further action will be taken based on its findings.",,21,0,39,2016,Janjgir-Champa Chhattisgarh,huntnews.in,http://huntnews.in/p/detail/2140341797570216?xlang=en&uc_param_str=dnfrpfbivesscpgimibtbmntnijblauputoggdnw&pos=1474663540489&channel=india&chncat=category_english,English ,
23,71.75,Pancmahal Gujarat,4454,23-12-2017,26-12-2017,Gujarat,Pancmahal,Nine children studying at a primary school in Godhra taluka of the Pancmahal district were admitted to the Godhra civil hospital on Friday with symptoms of food poisoning. The children are believed to have taken ill due to food consumed as part of the mid-day meal scheme at the school. he children from the Thanagarjan village complained of diarrhoea and vomiting on Friday. While some were treated a private clinics some others were brought to the Godhra civil hospital. Nine of the children were admitted to the hospital for treatment. t is believed that rice and lentil curry that the children consumed on Wednesday led to the incident. Officials of the Panchmahal district administration rushed to the school in wake of the development. They recorded the statements of the parents of the children.,,9,0,51,2017,Pancmahal Gujarat,Times of India,https://timesofindia.indiatimes.com/city/vadodara/nine-school-kids-fall-ill-after-eating-mid-day-meal/articleshow/62214642.cms,English ,
24.9785727,121.5822385,North Goa district Goa,3935,23-03-2017,23-03-2017,Goa,North Goa,"At least sixteen students of a primary school at Porvorim near Panaji took ill today due to suspected food poisoning after eating their mid-day meal. While five of them remained admitted at the Goa Medical College and Hospital (GMCH), the rest were discharged after they were treated at a Public Health Centre, a senior Education department official told PTI.The condition of the five students is stable now. The students started vomiting soon after having the meal at the government-run primary school, he said. Meanwhile, the State Education Director, Gajanan Bhat said his department has initiated inquiry into the incident. Director of the Department of Food and Drugs Administration (FDA) Salim Velji said samples of food were being collected, and they would soon be sent for analysis.He said FDA has asked the self-help group (SHG), providing mid-day meal to the school, to stop their services till further order.",,16,0,12,2017,North Goa district Goa,NDTV,http://www.ndtv.com/goa-news/16-students-fall-sick-after-eating-mid-day-meal-at-panjim-school-1672435,English ,
26.4691,74.639,Ajmer Rajasthan,5793,23-02-2020,24-02-2020,Rajasthan,Ajmer,"Seventeen students of a government school were hospitalised in Ajmer after consuming milk served during the mid-day meal on Saturday. The students from Arjun Pura Khalsa School were hospitalised after they complained of nausea, diarrhea, vomiting and stomach cramps. The children's condition is stable now. Speaking to ANI, KK Seni, Chief Medical Health Officer (CMHO) said, ",,17,0,9,2020,Ajmer Rajasthan,aninews.in,https://www.aninews.in/news/national/general-news/students-hold-india-us-flags-to-welcome-president-trump-in-ahmedabad20200224103529,English ,
18.316551,78.0539381,Kamareddy Telangana,6378,22-10-2021,22-10-2021,Telangana,Kamareddy,As many as 30 students fell ill after consuming lunch served at school in Banswada Mandal in Kamareddy district of Telangana on Thursday. The lunch was served to the students under the mid-day meal scheme. The students were shifted to the area hospital.,,30,0,43,2021,Kamareddy Telangana,Uni India,http://www.uniindia.com/30-school-students-fall-ill-after-eating-lunch-in-telangana/south/news/2540529.html,English ,
18.521428,73.8544541,Pune Maharashtra,5473,22-08-2019,22-08-2019,Maharashtra,Pune,"Students of Rambhau Mhalgi secondary school, and their principal, complained of nausea and stomach ache after eating a typical meal of khichdi prepared by a self-help group that was awarded a contract for providing meals by the school. As many as 22 students and the principal of Rambhau Mhalgi secondary school in Katraj fell ill in a case of suspected food poisoning after consuming a mid-day meal on Wednesday. According to the Bharati Vidyapeeth police station officials, the students and their principal complained of nausea and stomach ache after eating a typical meal of khichdi prepared by a self-help group (SHG) that was awarded a contract for providing meals by the school. All students were rushed to the nearby Bharati Hospital, where authorities said that four students have been admitted while the rest were discharged after a while.",,22,0,34,2019,Pune Maharashtra,The Hindu ,"English Newspaper 22th August, 2019/Page No. 07",English,
23.8339621,80.392456,Katni Madhya Pradesh,3534,22-07-2016,25-07-2016,Madhya Pradesh,Katni,"More than 30 students of a government primary school in Katni district of Madhya Pradesh were taken ill after consuming mid-day meal on Friday. The lunch was reportedly prepared by school teachers. Chief minister Shivraj Singh Chouhan and his government is already facing criticism over poor quality of relief material delivered to families during the recent flood situation in the state. he children at Katni's Bohriband tehsil had their meals around 12.30 pm and complained of dizziness before throwing up around 1 pm.They were taken to a government hospital where they were administered medicines, 25 of them were discharged later while five are said to be in a critical condition. arlier at least 41 children were taken ill, 11 critically, in February after consuming eatables under midday meal programme at a primary school in Betul district. They were referred to public health centre (PHC) in district's Atner area while the critical ones to the emergency ward of district hospital.More than 50 students had consumed the midday meal. Soon, 41 students developed diarrheal symptoms and began vomiting, said a government officer. Some of them fell unconscious. The matter was reported to police.",,30,0,30,2016,Katni Madhya Pradesh,Times of India,http://timesofindia.indiatimes.com/city/bhopal/30-children-fall-ill-after-mid-day-meal-in-Madhya-Pradesh/articleshow/53336674.cms,English ,
